{
  "schema_version": 1,
  "title": "看透银行：投资银行股从入门到精通",
  "author": "价投谷子地",
  "version": "2021年4月第1版；2021年5月第2次印刷",
  "local_paths_redacted": true,
  "portability_note": "Revision 3发布态skill沿用已核验的来源清单；本机绝对路径已清除，保留来源指纹、相对名称和定位规则。",
  "base_directory": null,
  "source_count": 2,
  "sources": [
    {
      "absolute_path": null,
      "relative_path": "source/kan-tou-yin-hang.txt",
      "sha256": "3e9693a6949eca2569646bb9927232f3a41e85b50dfac6bb051f915aac04f979",
      "bytes": 370934,
      "format": "txt",
      "source_id": "src-ktbank-txt-2021",
      "role": "primary",
      "kind": "book",
      "rights": {
        "basis": "user-provided",
        "redistribution": "restricted",
        "notes": "仅用于本次私有蒸馏与最短必要证据摘录；未推断额外许可。"
      },
      "extraction": {
        "parser": "manual UTF-8 line review with nl/sed/rg",
        "parser_version": "ripgrep 15.2.0; GNU sed 4.9; GNU nl 9.4",
        "text_artifact": "source/kan-tou-yin-hang.txt",
        "locator_scheme": "chapter > numbered section > subsection heading > UTF-8 TXT line number",
        "coverage": {
          "unit": "chapters",
          "expected_units": 10,
          "processed_units": 10,
          "omitted_ranges": [],
          "notes": "正文、序言与第1—10章均已审阅。TXT保留正文公式，但大量表格/图仅保留标题，具体单元格数值缺失。"
        }
      }
    },
    {
      "absolute_path": null,
      "relative_path": "source/kan-tou-yin-hang.epub",
      "sha256": "d1d0e286b0a8c9b498ed81c0a0d47d0c3b6098b66fee5367dafb349428bcc7ed",
      "bytes": 2377457,
      "format": "epub",
      "source_id": "src-ktbank-epub-2021",
      "role": "supplementary",
      "kind": "book",
      "rights": {
        "basis": "user-provided",
        "redistribution": "restricted",
        "notes": "作为章节锚点、元数据、公式与版式核对源；未推断额外许可。"
      },
      "extraction": {
        "parser": "EPUB ZIP/OPF/NCX/XHTML inspection",
        "parser_version": "Info-ZIP UnZip 6.00",
        "text_artifact": "source/kan-tou-yin-hang.epub",
        "locator_scheme": "EPUB spine XHTML file > element id > heading; images/<nnnnn>.jpeg for tables and figures",
        "coverage": {
          "unit": "chapters",
          "expected_units": 10,
          "processed_units": 10,
          "omitted_ranges": [],
          "notes": "核对了OPF/NCX、版权页、章节层级及关键公式所在XHTML；EPUB含105幅JPEG表格/图。未逐格OCR全部表格，故不从缺失表格重建历史样本数值。"
        }
      }
    }
  ],
  "manifest_id": "manifest.kan-tou-yin-hang",
  "created_at": "2026-09-03T12:01:14+08:00",
  "updated_at": "2026-09-03T12:31:49+08:00",
  "work": {
    "work_id": "work.kan-tou-yin-hang",
    "language": "zh-CN",
    "publication_year": 2021,
    "user_goal": "从原书独立提炼可执行的银行基本面、财报与估值能力，并保留精确证据、口径、单位、时效与监管边界。",
    "scope": {
      "included": [
        "银行负债、资产、中间业务与收入费用的经营逻辑",
        "银行财报阅读、净息差、资产质量、资本效率和内生增长",
        "银行估值与竞争优势证据链",
        "公式、指标口径、失败模式与书中案例的方法含义"
      ],
      "excluded": [
        "把旧skill或旧蒸馏当作原书权威；旧实现仅通过revision-2比较吸收有证据的执行设计",
        "用模型记忆更新2021年之后的监管制度、会计准则、阈值或市场事实",
        "个性化投资建议、买卖指令与实时证券推荐"
      ]
    }
  },
  "known_gaps": [
    {
      "gap_id": "gap-table-cells",
      "description": "TXT中多数表格和图仅保留标题；EPUB中的对应内容为JPEG，未逐格OCR。",
      "impact": "不能把书中历史样本表格当作完整可复算数据集；本skill仅使用正文明确给出的算式和数值示例。",
      "resolution": "接受为本轮限制；需要重建历史样本时再逐表人工核对EPUB图片。"
    },
    {
      "gap_id": "gap-current-rules",
      "description": "原书主要写于2019—2020年前后，含当时的监管阈值、制度状态、利率与市场判断。",
      "impact": "这些内容只能证明作者当时的主张，不能作为当前规则或当前估值常量。",
      "resolution": "所有易变规则与阈值均标为历史/待外部权威核验；本轮不凭记忆更新。"
    },
    {
      "gap_id": "gap-author-identity",
      "description": "版权页署名为“价投谷子地”，EPUB OPF元数据creator为“胡云飞”。",
      "impact": "不影响正文能力提取，但作者身份字段存在署名与元数据差异。",
      "resolution": "manifest采用版权页公开署名，并在此保留差异。"
    }
  ],
  "readiness": {
    "exact_version_identified": true,
    "integrity_recorded": true,
    "rights_reviewed": true,
    "coverage_reviewed": true,
    "ready_for_distillation": true
  }
}
